ProdName,ProdPrice,Rating
"Lenovo V145-AMD-A6 15.6 inch HD Thin and Light Laptop (4GB RAM/ 500GB HDD/ Windows 10 Home with Lifetime Validity/ Black/ 2.1 kg), 81MT004BIH","16,890",3.3 out of 5 stars
Dell Inspiron 3567 Intel Core i3 7th Gen 15.6-inch FHD Laptop (4GB/1TB HDD/Windows 10 Home + MS Office/Black/2.5kg),"26,990",3.1 out of 5 stars
Universal Silicone Keyboard Protector Skin for 15.6-inch Laptop,65,2.9 out of 5 stars
AWINNER Universal Silicone Keyboard Protector Skin for 15.6-inch Laptop,79,3.3 out of 5 stars
TARKAN Foldable Wooden Laptop Desk for Bed (Walnut Black),799,3.9 out of 5 stars
"Gizga Essentials GZ-CK-104 Professional 6-in-1 Cleaning Kit (Air Blower, Cotton Swabs, Suede + Plush Micro-Fiber Cloth, Brush,Cleaning Solution)",249,4.0 out of 5 stars
Logitech B170 Wireless Mouse (Black),569,4.4 out of 5 stars
HP X1000 Wired Mouse (Black/Grey),290,4.2 out of 5 stars
Clublaptop Reversible 15.6-inch Laptop Sleeve,175,3.9 out of 5 stars
Quantum QHM495LM 6 Light Webcam For Laptop/Desktop (Black),398,3.1 out of 5 stars
Portronics POR-704 Adjustable Laptop Table (Grey),"1,549",4.4 out of 5 stars
Gizga Essentials Laptop Power Cable Cord- 3 Pin Adapter Isi Certified(1 Meter/3.3 Feet),189,4.1 out of 5 stars
AmazonBasics Ventilated Laptop Stand (Black),759,4.3 out of 5 stars
Dell MS116 1000DPI USB Wired Optical Mouse,299,4.5 out of 5 stars
Ebee Brown Laptop Table with Drawer,999,3.4 out of 5 stars
"Paper Plane Design Army Collection Laptop Skins Sticker For Dell, Hp, Toshiba, Acer, Asus & All Models (Upto 15.6 inches)",119,3.7 out of 5 stars
Lenovo 888015000 65W Laptop Adapter/Charger with Power Cord for Select Models of Lenovo (Slim Tip Rectangular pin),"1,150",4.2 out of 5 stars
Dahsha 4.5 Feet 3 Pin Laptop Power Cable Cord Charger Adapter - 1 Year Warranty,249,4.1 out of 5 stars
ASA Global Solution Inner Protection and Water Resistance 15.6 inch Grey Laptop Sleeve with Main Utility Pocket,335,4.4 out of 5 stars
"STRIFF Laptop Stand, Invisible Lightweight Computer Stand, Portable Foldable Holder Fit for MacBook, Air,Pro,Ipad,Notebook and Tablet(Gray)",399,3.6 out of 5 stars
Dewberries Anti-Theft Water Resistant Computer USB Charging Port Lightweight Laptop Backpack Bag Fitting 15.6-inch Laptops Tablets,,3.7 out of 5 stars
GIZGA 1 Meter 3 Pin Laptop Power Cable Cord (Black),149,4.2 out of 5 stars
Gizga Essentials Laptop Bag Sleeve for 15 Inch-15.6 inch Laptop Case Cover Pouch MacBook Pro (Grey),339,4.1 out of 5 stars
"Table Black Strong and Sturdy for Studies, Laptop, Patient Dining, Foldable, Multi Purpose","1,375",4.0 out of 5 stars
HP 13.3-inch Series Laptop Adapter Charger 65W 19.5V 3.33A Bluetip for HP Envy 15-j000 5 x360 TPN-Q146 X2 13,"1,150",2.9 out of 5 stars
"PIXELARTZ PA-15.6LS-3052 Laptop Skin, 15.6-Inches, Multicolour",215,4.1 out of 5 stars
HP HS04 Laptop Battery,"2,800",3.9 out of 5 stars
ADATA 8GB DDR4 modules for notebooks 2666 Laptop Memory (AD4S266638G19-R),"2,999",4.7 out of 5 stars
"AirCase Laptop Bag Sleeve Case Cover for 13-Inch, 13.3-Inch Laptop MacBook, Neoprene (Black)",360,4.0 out of 5 stars
AmazonBasics 13.3-inch Laptop Sleeve (Black),609,4.5 out of 5 stars
ASUS 15.6" inch Casual Laptop Backpack (Black),448,4.2 out of 5 stars
ZALTAN Laptop Messenger Handbag Durable Briefcase PU Leather Carrying Case for 15.6 in Laptops & Notebooks with Shoulder Strap (Multi Colour),599,4.2 out of 5 stars
Starnv NV Bags Hydraflex 14-inch Black Expandable Sleeve Case Laptop Bag,338,4.3 out of 5 stars
"AirCase Laptop Bag Sleeve Case Cover for 14-Inch Laptop MacBook, Protective, Neoprene (Black)",379,4.0 out of 5 stars
"Moksh™ 15.6 Inch Reversible Laptop Sleeve Cover Case for HP, Lenovo, Dell, Asus, Acer, Sony, Apple MacBook",139,4.5 out of 5 stars
Sangra® Laptop Bags Sleeve Notebook Case 13-Inch 13.3-Inch 14-Inch with Compartment (Black),299,4.4 out of 5 stars
